{
  "output_schema": 1,
  "status": "unsupported",
  "source": {
    "framework_version": "v0.4.0",
    "package": {
      "id": "hegira-canonical",
      "version": "v0.4.0"
    }
  },
  "target": null,
  "composition": {
    "components": [
      {
        "id": "layered-base",
        "version": "v0.4.0"
      },
      {
        "id": "layered-leptos-identity",
        "version": "v0.4.0"
      }
    ],
    "modules": [
      {
        "id": "identity",
        "version": "v0.4.0"
      }
    ],
    "capabilities": [
      "authentication",
      "authorization"
    ],
    "databases": [
      "sqlite"
    ],
    "clients": [
      "leptos"
    ]
  },
  "recovery": "pass",
  "managed_boundaries": "unverified",
  "diagnostics": [
    {
      "code": "direct-edge",
      "message": "No supported direct upgrade exists for the recorded release."
    }
  ]
}
