{
  "output_schema": 1,
  "status": "incompatible",
  "source": {
    "framework_version": "v0.7.0",
    "package": {
      "id": "hegira-canonical",
      "version": "v0.7.0"
    }
  },
  "target": {
    "framework_version": "v0.8.0",
    "package": {
      "id": "hegira-canonical",
      "version": "v0.8.0"
    }
  },
  "composition": {
    "components": [
      {
        "id": "custom-component",
        "version": "v0.7.0"
      },
      {
        "id": "layered-base",
        "version": "v0.7.0"
      },
      {
        "id": "layered-leptos-identity",
        "version": "v0.7.0"
      }
    ],
    "modules": [
      {
        "id": "identity",
        "version": "v0.7.0"
      }
    ],
    "capabilities": [
      "authentication",
      "authorization"
    ],
    "databases": [
      "sqlite"
    ],
    "clients": [
      "leptos"
    ]
  },
  "recovery": "pass",
  "managed_boundaries": "blocked",
  "diagnostics": [
    {
      "code": "composition",
      "message": "The direct upgrade does not support this composition or adapter selection."
    }
  ]
}
